Title,Link
Interview with Jeffery Goldberg of The Atlantic,https://www.presidency.ucsb.edu/documents/interview-with-jeffery-goldberg-the-atlantic
Interview with Ilana Dayan of Israel Channel 2,https://www.presidency.ucsb.edu/documents/interview-with-ilana-dayan-israel-channel-2
Interview with Estela Casas of ABC-7 KVIA,https://www.presidency.ucsb.edu/documents/interview-with-estela-casas-abc-7-kvia
Interview With Dennis Bounds of KING 5,https://www.presidency.ucsb.edu/documents/interview-with-dennis-bounds-king-5
"The President's News Conference in Krün, Germany",https://www.presidency.ucsb.edu/documents/the-presidents-news-conference-krun-germany
"Interview With Marc Maron for the WTF With Marc Maron Podcast in Highland Park, California",https://www.presidency.ucsb.edu/documents/interview-with-marc-maron-for-the-wtf-with-marc-maron-podcast-highland-park-california
The President's News Conference With President Dilma Rousseff of Brazil,https://www.presidency.ucsb.edu/documents/the-presidents-news-conference-with-president-dilma-rousseff-brazil
The President's News Conference,https://www.presidency.ucsb.edu/documents/the-presidents-news-conference-1144
Interview with Jon Sopel of BBC,https://www.presidency.ucsb.edu/documents/interview-with-jon-sopel-bbc
"The President's News Conference With President Uhuru Kenyatta of Kenya in Nairobi, Kenya",https://www.presidency.ucsb.edu/documents/the-presidents-news-conference-with-president-uhuru-kenyatta-kenya-nairobi-kenya
"The President's News Conference With Prime Minister Hailemariam Desalegn of Ethiopia in Addis Ababa, Ethiopia",https://www.presidency.ucsb.edu/documents/the-presidents-news-conference-with-prime-minister-hailemariam-desalegn-ethiopia-addis
"Interview with Fareed Zakaria of CNN's ""GPS""",https://www.presidency.ucsb.edu/documents/interview-with-fareed-zakaria-cnns-gps
Interview With Steve Inskeep of National Public Radio,https://www.presidency.ucsb.edu/documents/interview-with-steve-inskeep-national-public-radio-0
Interview with Jake Horowitz of Mic,https://www.presidency.ucsb.edu/documents/interview-with-jake-horowitz-mic
Interview with Maureen Bunyan of ABC 7,https://www.presidency.ucsb.edu/documents/interview-with-maureen-bunyan-abc-7
Interview with Monica Malpass of Action News,https://www.presidency.ucsb.edu/documents/interview-with-monica-malpass-action-news
Interview with Jane Eisner of FORWARD,https://www.presidency.ucsb.edu/documents/interview-with-jane-eisner-forward
Interview with George Stephanopoulos of ABC,https://www.presidency.ucsb.edu/documents/interview-with-george-stephanopoulos-abc
"Remarks with Marilynne Robinson in Des Moines, Iowa",https://www.presidency.ucsb.edu/documents/remarks-with-marilynne-robinson-des-moines-iowa
The President's News Conference With President Xi Jinping of China,https://www.presidency.ucsb.edu/documents/the-presidents-news-conference-with-president-xi-jinping-china
The President's News Conference,https://www.presidency.ucsb.edu/documents/the-presidents-news-conference-1143
Interview with Kai Ryssdal of The Marketplace,https://www.presidency.ucsb.edu/documents/interview-with-kai-ryssdal-the-marketplace
Interview with Steve Kroft of CBS,https://www.presidency.ucsb.edu/documents/interview-with-steve-kroft-cbs
The President's News Conference With President Park Geun-hye of South Korea,https://www.presidency.ucsb.edu/documents/the-presidents-news-conference-with-president-park-geun-hye-south-korea
"The President's News Conference in Belek, Turkey",https://www.presidency.ucsb.edu/documents/the-presidents-news-conference-belek-turkey
"The President's News Conference in Kuala Lumpur, Malaysia",https://www.presidency.ucsb.edu/documents/the-presidents-news-conference-kuala-lumpur-malaysia
The President's News Conference With President François Hollande of France,https://www.presidency.ucsb.edu/documents/the-presidents-news-conference-with-president-francois-hollande-france
"The President's News Conference in Issy-les-Moulineaux, France",https://www.presidency.ucsb.edu/documents/the-presidents-news-conference-issy-les-moulineaux-france
The President's News Conference,https://www.presidency.ucsb.edu/documents/the-presidents-news-conference-1142
Interview with Steve Inskeep of National Public Radio,https://www.presidency.ucsb.edu/documents/interview-with-steve-inskeep-national-public-radio-2
Address Before a Joint Session of the Congress on the State of the Union,https://www.presidency.ucsb.edu/documents/address-before-joint-session-the-congress-the-state-the-union-19
"Interview with YouTube Stars Ingrid Nilsen, Destin Sandlin, and sWooZie",https://www.presidency.ucsb.edu/documents/interview-with-youtube-stars-ingrid-nilsen-destin-sandlin-and-swoozie
Interview with Glenn Thrush of POLITICO,https://www.presidency.ucsb.edu/documents/interview-with-glenn-thrush-politico
"Interview with the Los Angeles Times at the Hoogland Center in Springfield, Illinois",https://www.presidency.ucsb.edu/documents/interview-with-the-los-angeles-times-the-hoogland-center-springfield-illinois
"The President's News Conference in Rancho Mirage, California",https://www.presidency.ucsb.edu/documents/the-presidents-news-conference-rancho-mirage-california
"Interview with Maya Rhodan of ""TIME""",https://www.presidency.ucsb.edu/documents/interview-with-maya-rhodan-time
The President's News Conference With Prime Minister Justin P.J. Trudeau of Canada,https://www.presidency.ucsb.edu/documents/the-presidents-news-conference-with-prime-minister-justin-pj-trudeau-canada-0
Interview with Nina Totenberg of National Public Radio,https://www.presidency.ucsb.edu/documents/interview-with-nina-totenberg-national-public-radio
"The President's News Conference With President Raúl Castro Ruz of Cuba in Havana, Cuba",https://www.presidency.ucsb.edu/documents/the-presidents-news-conference-with-president-raul-castro-ruz-cuba-havana-cuba
"The President's News Conference With President Mauricio Macri of Argentina in Buenos Aires, Argentina",https://www.presidency.ucsb.edu/documents/the-presidents-news-conference-with-president-mauricio-macri-argentina-buenos-aires
The President's News Conference,https://www.presidency.ucsb.edu/documents/the-presidents-news-conference-1141
Interview with Chris Wallace of Fox News Sunday,https://www.presidency.ucsb.edu/documents/interview-with-chris-wallace-fox-news-sunday-3
Interview with Charlie Rose,https://www.presidency.ucsb.edu/documents/interview-with-charlie-rose-0
"The President's News Conference With Prime Minister David W.D. Cameron of the United Kingdom in London, England",https://www.presidency.ucsb.edu/documents/the-presidents-news-conference-with-prime-minister-david-wd-cameron-the-united-kingdom
"The President's News Conference With Chancellor Angela Merkel of Germany in Hannover, Germany",https://www.presidency.ucsb.edu/documents/the-presidents-news-conference-with-chancellor-angela-merkel-germany-hannover-germany
"Interview with Charlie Rose in Hanover, Germany",https://www.presidency.ucsb.edu/documents/interview-with-charlie-rose-hanover-germany
Interview by Phone with the Daily Targum inside WRSU-FM,https://www.presidency.ucsb.edu/documents/interview-phone-with-the-daily-targum-inside-wrsu-fm
"The President's News Conference With President Trần Đại Quang of Vietnam in Hanoi, Vietnam",https://www.presidency.ucsb.edu/documents/the-presidents-news-conference-with-president-tran-dai-quang-vietnam-hanoi-vietnam
Interview with Steve Inskeep of National Public Radio,https://www.presidency.ucsb.edu/documents/interview-with-steve-inskeep-national-public-radio-4
"The President's News Conference With Prime Minister Justin P.J. Trudeau of Canada and President Enrique Peña Nieto of Mexico in Ottawa, Canada",https://www.presidency.ucsb.edu/documents/the-presidents-news-conference-with-prime-minister-justin-pj-trudeau-canada-and-president
"The President's News Conference in Warsaw, Poland",https://www.presidency.ucsb.edu/documents/the-presidents-news-conference-warsaw-poland
The President's News Conference With President Enrique Peña Nieto of Mexico,https://www.presidency.ucsb.edu/documents/the-presidents-news-conference-with-president-enrique-pena-nieto-mexico
"Interview with John Dickerson of CBS's ""Face the Nation""",https://www.presidency.ucsb.edu/documents/interview-with-john-dickerson-cbss-face-the-nation
"Remarks at the Democratic National Convention in Philadelphia, Pennsylvania",https://www.presidency.ucsb.edu/documents/remarks-the-democratic-national-convention-philadelphia-pennsylvania-0
The President's News Conference With Prime Minister Lee Hsien Loong of Singapore,https://www.presidency.ucsb.edu/documents/the-presidents-news-conference-with-prime-minister-lee-hsien-loong-singapore
"The President's New Conference at the Pentagon in Arlington, Virginia",https://www.presidency.ucsb.edu/documents/the-presidents-new-conference-the-pentagon-arlington-virginia
Interview with Joi Ito of MIT and Scott Dadich of WIRED,https://www.presidency.ucsb.edu/documents/interview-with-joi-ito-mit-and-scott-dadich-wired
Interview with Fareed Zakaria of CNN,https://www.presidency.ucsb.edu/documents/interview-with-fareed-zakaria-cnn
"The President's News Conference in Hangzhou, China",https://www.presidency.ucsb.edu/documents/the-presidents-news-conference-hangzhou-china
"The President's News Conference in Vientiane, Laos",https://www.presidency.ucsb.edu/documents/the-presidents-news-conference-vientiane-laos
Exit Interview with Doris Kearns Goodwin,https://www.presidency.ucsb.edu/documents/exit-interview-with-doris-kearns-goodwin
Interview with Ta-Nehisi Coates,https://www.presidency.ucsb.edu/documents/interview-with-ta-nehisi-coates
The President's News Conference With Prime Minister Matteo Renzi of Italy,https://www.presidency.ucsb.edu/documents/the-presidents-news-conference-with-prime-minister-matteo-renzi-italy
Interview with Ta-Nehisi Coates,https://www.presidency.ucsb.edu/documents/interview-with-ta-nehisi-coates-2
Interview with Ta-Nehisi Coates,https://www.presidency.ucsb.edu/documents/interview-with-ta-nehisi-coates-1
"Interview with Jann Wenner of ""Rolling Stone""",https://www.presidency.ucsb.edu/documents/interview-with-jann-wenner-rolling-stone
The President's News Conference,https://www.presidency.ucsb.edu/documents/the-presidents-news-conference-1140
"The President's News Conference With Prime Minister Alexios Tsipras of Greece in Athens, Greece",https://www.presidency.ucsb.edu/documents/the-presidents-news-conference-with-prime-minister-alexios-tsipras-greece-athens-greece
Interview with Ta-Nehisi Coates,https://www.presidency.ucsb.edu/documents/interview-with-ta-nehisi-coates-0
"The President's News Conference With Chancellor Angela Merkel of Germany in Berlin, Germany",https://www.presidency.ucsb.edu/documents/the-presidents-news-conference-with-chancellor-angela-merkel-germany-berlin-germany
"The President's News Conference in Lima, Peru",https://www.presidency.ucsb.edu/documents/the-presidents-news-conference-lima-peru
Interview with Steve Inskeep of National Public Radio,https://www.presidency.ucsb.edu/documents/interview-with-steve-inskeep-national-public-radio-3
The President's News Conference,https://www.presidency.ucsb.edu/documents/the-presidents-news-conference-1139
"Interview with David Axelrod on CNN's ""The Axe Files""",https://www.presidency.ucsb.edu/documents/interview-with-david-axelrod-cnns-the-axe-files
Interview on the Patient Protection and Affordable Care Act With Ezra Klein and Sarah Kliff of Vox,https://www.presidency.ucsb.edu/documents/interview-the-patient-protection-and-affordable-care-act-with-ezra-klein-and-sarah-kliff
"Interview with George Stephanopoulos of ABC News' ""This Week""",https://www.presidency.ucsb.edu/documents/interview-with-george-stephanopoulos-abc-news-this-week-15
"Farewell Address to the Nation From Chicago, Illinois",https://www.presidency.ucsb.edu/documents/farewell-address-the-nation-from-chicago-illinois
"Interview with Steve Kroft of CBS News ""60 Minutes""",https://www.presidency.ucsb.edu/documents/interview-with-steve-kroft-cbs-news-60-minutes-2
Interview with Michiko Kakutani of the New York Times,https://www.presidency.ucsb.edu/documents/interview-with-michiko-kakutani-the-new-york-times
The President's News Conference,https://www.presidency.ucsb.edu/documents/the-presidents-news-conference-1084
Remarks About Tech with Pod Save America,https://www.presidency.ucsb.edu/documents/remarks-about-tech-with-pod-save-america
