Title,Link
"The President's News Conference With Prime Minister Julia E. Gillard of Australia in Canberra, Australia",https://www.presidency.ucsb.edu/documents/the-presidents-news-conference-with-prime-minister-julia-e-gillard-australia-canberra
The President's News Conference With Prime Minister Stephen J. Harper of Canada,https://www.presidency.ucsb.edu/documents/the-presidents-news-conference-with-prime-minister-stephen-j-harper-canada
"Interview with Steve Kroft on CBS News ""60 Minutes""",https://www.presidency.ucsb.edu/documents/interview-with-steve-kroft-cbs-news-60-minutes-1
The President's News Conference With Prime Minister Nuri al-Maliki of Iraq,https://www.presidency.ucsb.edu/documents/the-presidents-news-conference-with-prime-minister-nuri-al-maliki-iraq-0
Interview of the President and First Lady by Barbara Walters of ABC News,https://www.presidency.ucsb.edu/documents/interview-the-president-and-first-lady-barbara-walters-abc-news
Interview with Fareed Zakaria of Time Magazine,https://www.presidency.ucsb.edu/documents/interview-with-fareed-zakaria-time-magazine
Address Before a Joint Session of the Congress on the State of the Union,https://www.presidency.ucsb.edu/documents/address-before-joint-session-the-congress-the-state-the-union-15
Interview with Maria Elena Salinas of Univision,https://www.presidency.ucsb.edu/documents/interview-with-maria-elena-salinas-univision
"Interview with Diane Sawyer of ABC's ""World News""",https://www.presidency.ucsb.edu/documents/interview-with-diane-sawyer-abcs-world-news
Interview with Matt Lauer of NBC News,https://www.presidency.ucsb.edu/documents/interview-with-matt-lauer-nbc-news
Interview with Bill Simmons of ESPN,https://www.presidency.ucsb.edu/documents/interview-with-bill-simmons-espn
Interview with Jeffrey Goldberg of The Atlantic,https://www.presidency.ucsb.edu/documents/interview-with-jeffrey-goldberg-the-atlantic
The President's News Conference,https://www.presidency.ucsb.edu/documents/the-presidents-news-conference-1107
The President's News Conference With Prime Minister David Cameron of the United Kingdom,https://www.presidency.ucsb.edu/documents/the-presidents-news-conference-with-prime-minister-david-cameron-the-united-kingdom-3
"Interview with Kai Ryssdal of The Marketplace at the Copper Mountain Solar Plant in Boulder City, Nevada",https://www.presidency.ucsb.edu/documents/interview-with-kai-ryssdal-the-marketplace-the-copper-mountain-solar-plant-boulder-city
The President's News Conference With President Lee Myung-bak of South Korea in Seoul,https://www.presidency.ucsb.edu/documents/the-presidents-news-conference-with-president-lee-myung-bak-south-korea-seoul-1
The President's News Conference With President Felipe de Jesus Calderon Hinojosa of Mexico and Prime Minister Stephen J. Harper of Canada,https://www.presidency.ucsb.edu/documents/the-presidents-news-conference-with-president-felipe-de-jesus-calderon-hinojosa-mexico-3
The President's News Conference With President Juan Manuel Santos Calderon of Colombia in Cartagena,https://www.presidency.ucsb.edu/documents/the-presidents-news-conference-with-president-juan-manuel-santos-calderon-colombia
The President's News Conference With Prime Minister Yoshihiko Noda of Japan,https://www.presidency.ucsb.edu/documents/the-presidents-news-conference-with-prime-minister-yoshihiko-noda-japan
Interview with Robin Roberts of ABC News,https://www.presidency.ucsb.edu/documents/interview-with-robin-roberts-abc-news
The President's News Conference in Chicago,https://www.presidency.ucsb.edu/documents/the-presidents-news-conference-chicago-0
The President's News Conference in Los Cabos,https://www.presidency.ucsb.edu/documents/the-presidents-news-conference-los-cabos
Interview with the First Lady and Charlie Rose of CBS News,https://www.presidency.ucsb.edu/documents/interview-with-the-first-lady-and-charlie-rose-cbs-news
Interview with Scott Thuman of ABC7,https://www.presidency.ucsb.edu/documents/interview-with-scott-thuman-abc7
Interview With Mark Jones of ESPN2 During a United States-Brazil Men's Basketball Game,https://www.presidency.ucsb.edu/documents/interview-with-mark-jones-espn2-during-united-states-brazil-mens-basketball-game
"Interview with Cindi Leive of Glamour Magazine in Portland, Oregon",https://www.presidency.ucsb.edu/documents/interview-with-cindi-leive-glamour-magazine-portland-oregon
Interview with the Associated Press,https://www.presidency.ucsb.edu/documents/interview-with-the-associated-press
"Remarks Accepting the Presidential Nomination at the Democratic National Convention in Charlotte, North Carolina",https://www.presidency.ucsb.edu/documents/remarks-accepting-the-presidential-nomination-the-democratic-national-convention-charlotte
Interview with Savannah Guthrie of NBC at the Education Nation Summit,https://www.presidency.ucsb.edu/documents/interview-with-savannah-guthrie-nbc-the-education-nation-summit
"Presidential Debate in Denver, Colorado",https://www.presidency.ucsb.edu/documents/presidential-debate-denver-colorado
Interview with Douglas Brinkley of Rolling Stone,https://www.presidency.ucsb.edu/documents/interview-with-douglas-brinkley-rolling-stone
"Presidential Debate in Hempstead, New York",https://www.presidency.ucsb.edu/documents/presidential-debate-hempstead-new-york
Interview with Jon Stewart of Comedy Central's The Daily Show,https://www.presidency.ucsb.edu/documents/interview-with-jon-stewart-comedy-centrals-the-daily-show-0
"Presidential Debate in Boca Raton, Florida",https://www.presidency.ucsb.edu/documents/presidential-debate-boca-raton-florida
Interview With Kyle Clark of Denver 9 News,https://www.presidency.ucsb.edu/documents/interview-with-kyle-clark-denver-9-news
Interview with Mika Brzezinski and Joe Scarborough of MSNBC,https://www.presidency.ucsb.edu/documents/interview-with-mika-brzezinski-and-joe-scarborough-msnbc
The President's News Conference,https://www.presidency.ucsb.edu/documents/the-presidents-news-conference-1156
"The President's News Conference With Prime Minister Yinglak Chinnawat of Thailand in Bangkok, Thailand",https://www.presidency.ucsb.edu/documents/the-presidents-news-conference-with-prime-minister-yinglak-chinnawat-thailand-bangkok
"Interview with Frank Vascellaro of CBS WCCP, Minnesota",https://www.presidency.ucsb.edu/documents/interview-with-frank-vascellaro-cbs-wccp-minnesota
The President's New Conference,https://www.presidency.ucsb.edu/documents/the-presidents-new-conference
The President's News Conference With President Hamid Karzai of Afghanistan,https://www.presidency.ucsb.edu/documents/the-presidents-news-conference-with-president-hamid-karzai-afghanistan-3
The President's News Conference,https://www.presidency.ucsb.edu/documents/the-presidents-news-conference-1157
Inaugural Address,https://www.presidency.ucsb.edu/documents/inaugural-address-15
Interview with Franklin Foer and Chris Hughes,https://www.presidency.ucsb.edu/documents/interview-with-franklin-foer-and-chris-hughes
"Interview of President Obama and Secretary of State Clinton with Steve Kroft of CBS's ""60 Minutes""",https://www.presidency.ucsb.edu/documents/interview-president-obama-and-secretary-state-clinton-with-steve-kroft-cbss-60-minutes
Interview with Maria Elena Salinas of  Univision News,https://www.presidency.ucsb.edu/documents/interview-with-maria-elena-salinas-univision-news
"Interview with Scott Pelley of the CBS ""Evening News""",https://www.presidency.ucsb.edu/documents/interview-with-scott-pelley-the-cbs-evening-news
Address Before a Joint Session of Congress on the State of the Union,https://www.presidency.ucsb.edu/documents/address-before-joint-session-congress-the-state-the-union-2
The President's News Conference,https://www.presidency.ucsb.edu/documents/the-presidents-news-conference-1155
"The President's News Conference With Prime Minister Benjamin Netanyahu of Israel in Jerusalem, Israel",https://www.presidency.ucsb.edu/documents/the-presidents-news-conference-with-prime-minister-benjamin-netanyahu-israel-jerusalem
"The President's News Conference With President Mahmoud Abbas of the Palestinian Authority in Ramallah, West Bank",https://www.presidency.ucsb.edu/documents/the-presidents-news-conference-with-president-mahmoud-abbas-the-palestinian-authority-2
"The President's News Conference With King Abdullah II of Jordan in Amman, Jordan",https://www.presidency.ucsb.edu/documents/the-presidents-news-conference-with-king-abdullah-ii-jordan-amman-jordan
"Interview with Savannah Guthrie of NBC's ""Today Show""",https://www.presidency.ucsb.edu/documents/interview-with-savannah-guthrie-nbcs-today-show
The President's News Conference,https://www.presidency.ucsb.edu/documents/the-presidents-news-conference-1154
"The President's News Conference With President Enrique Peña Nieto of Mexico in Mexico City, Mexico",https://www.presidency.ucsb.edu/documents/the-presidents-news-conference-with-president-enrique-pena-nieto-mexico-mexico-city-mexico
"The President's News Conference With President Laura Chinchilla Miranda of Costa Rica in San Jose, Costa Rica",https://www.presidency.ucsb.edu/documents/the-presidents-news-conference-with-president-laura-chinchilla-miranda-costa-rica-san-jose
The President's News Conference With President Park Geun-hye of South Korea,https://www.presidency.ucsb.edu/documents/the-presidents-news-conference-with-president-park-geun-hye-south-korea-0
The President's News Conference With Prime Minister David Cameron of the United Kingdom,https://www.presidency.ucsb.edu/documents/the-presidents-news-conference-with-prime-minister-david-cameron-the-united-kingdom-2
The President's News Conference With Prime Minister Recep Tayyip Erdogan of Turkey,https://www.presidency.ucsb.edu/documents/the-presidents-news-conference-with-prime-minister-recep-tayyip-erdogan-turkey
"Interview with Charlie Rose on PBS ""Charlie Rose""",https://www.presidency.ucsb.edu/documents/interview-with-charlie-rose-pbs-charlie-rose
"The President's News Conference With Chancellor Angela Merkel of Germany in Berlin, Germany",https://www.presidency.ucsb.edu/documents/the-presidents-news-conference-with-chancellor-angela-merkel-germany-berlin-germany-0
"The President's News Conference With President Macky Sall of Senegal in Dakar, Senegal",https://www.presidency.ucsb.edu/documents/the-presidents-news-conference-with-president-macky-sall-senegal-dakar-senegal
"The President's News Conference With President Jacob Zuma of South Africa in Pretoria, South Africa",https://www.presidency.ucsb.edu/documents/the-presidents-news-conference-with-president-jacob-zuma-south-africa-pretoria-south
"The President's News Conference With President Jakaya Mrisho Kikwete of Tanzania in Dar es Salaam, Tanzania",https://www.presidency.ucsb.edu/documents/the-presidents-news-conference-with-president-jakaya-mrisho-kikwete-tanzania-dar-es-0
Interview with Jackie Calmes and Michael D. Shear of the New York Times,https://www.presidency.ucsb.edu/documents/interview-with-jackie-calmes-and-michael-d-shear-the-new-york-times
"Interview of the President by Jay Leno on The Tonight Show in Burbank, California",https://www.presidency.ucsb.edu/documents/interview-the-president-jay-leno-the-tonight-show-burbank-california
The President's News Conference,https://www.presidency.ucsb.edu/documents/the-presidents-news-conference-1153
"Interview with Chris Cuomo of CNN's ""New Day""",https://www.presidency.ucsb.edu/documents/interview-with-chris-cuomo-cnns-new-day-2
"The President's News Conference With Prime Minister John Fredrik Reinfeldt of Sweden in Stockholm, Sweden",https://www.presidency.ucsb.edu/documents/the-presidents-news-conference-with-prime-minister-john-fredrik-reinfeldt-sweden-stockholm
"The President's News Conference in St. Petersburg, Russia",https://www.presidency.ucsb.edu/documents/the-presidents-news-conference-st-petersburg-russia
"Interview with Gwen Ifill of PBS ""NewsHour""",https://www.presidency.ucsb.edu/documents/interview-with-gwen-ifill-pbs-newshour
Interview with Diane Sawyer of ABC News,https://www.presidency.ucsb.edu/documents/interview-with-diane-sawyer-abc-news
"Interview with Savannah Guthrie of NBC's ""Nightly News""",https://www.presidency.ucsb.edu/documents/interview-with-savannah-guthrie-nbcs-nightly-news
"Interview with Chris Wallace of Fox News ""Special Report""",https://www.presidency.ucsb.edu/documents/interview-with-chris-wallace-fox-news-special-report
"Interview with Wolf Blitzer of CNN's ""The Situation Room""",https://www.presidency.ucsb.edu/documents/interview-with-wolf-blitzer-cnns-the-situation-room-2
"Interview with Scott Pelley of CBS ""Evening News""",https://www.presidency.ucsb.edu/documents/interview-with-scott-pelley-cbs-evening-news
"Interview with George Stephanopoulos of ABC's ""This Week""",https://www.presidency.ucsb.edu/documents/interview-with-george-stephanopoulos-abcs-this-week
"Interview with Steve Inskeep of National Public Radio's ""All Things Considered""",https://www.presidency.ucsb.edu/documents/interview-with-steve-inskeep-national-public-radios-all-things-considered
Interview with John Harwood of CNBC,https://www.presidency.ucsb.edu/documents/interview-with-john-harwood-cnbc-1
Interview with Julie Pace of The Associated Press,https://www.presidency.ucsb.edu/documents/interview-with-julie-pace-the-associated-press
The President's News Conference,https://www.presidency.ucsb.edu/documents/the-presidents-news-conference-1152
Interview with Tracy Sears of CBS WTVR News,https://www.presidency.ucsb.edu/documents/interview-with-tracy-sears-cbs-wtvr-news
Interview with Chuck Todd of NBC News,https://www.presidency.ucsb.edu/documents/interview-with-chuck-todd-nbc-news
The President's News Conference,https://www.presidency.ucsb.edu/documents/the-presidents-news-conference-1150
"Interview with Chris Mathews on MSNBC's ""Hardball"" at American University",https://www.presidency.ucsb.edu/documents/interview-with-chris-mathews-msnbcs-hardball-american-university
The President's News Conference,https://www.presidency.ucsb.edu/documents/the-presidents-news-conference-1151
Interview with Claus Kleber,https://www.presidency.ucsb.edu/documents/interview-with-claus-kleber
Address Before a Joint Session of the Congress on the State of the Union,https://www.presidency.ucsb.edu/documents/address-before-joint-session-the-congress-the-state-the-union-21
"Interview with Jake Tapper of CNN's ""New Day""",https://www.presidency.ucsb.edu/documents/interview-with-jake-tapper-cnns-new-day
"Interview with Bill O'Reilly of Fox News Channel's ""The O'Reilly Factor""",https://www.presidency.ucsb.edu/documents/interview-with-bill-oreilly-fox-news-channels-the-oreilly-factor-0
"Interview with Jake Tapper on CNN's ""State of the Union""",https://www.presidency.ucsb.edu/documents/interview-with-jake-tapper-cnns-state-the-union-3
"Interview with Bill O'Reilly of Fox News Channel's ""The O'Reilly Factor""",https://www.presidency.ucsb.edu/documents/interview-with-bill-oreilly-fox-news-channels-the-oreilly-factor
Interview with Bob Costas on NBC Olympics Primetime and Late Night,https://www.presidency.ucsb.edu/documents/interview-with-bob-costas-nbc-olympics-primetime-and-late-night
The President's News Conference With President François Hollande of France,https://www.presidency.ucsb.edu/documents/the-presidents-news-conference-with-president-francois-hollande-france-0
"The President's News Conference With President Enrique Peña Nieto of Mexico and Prime Minister Stephen J. Harper of Canada in Toluca, Mexico",https://www.presidency.ucsb.edu/documents/the-presidents-news-conference-with-president-enrique-pena-nieto-mexico-and-prime-minister
"Interview with Jeffrey Goldberg of Bloomberg's ""View""",https://www.presidency.ucsb.edu/documents/interview-with-jeffrey-goldberg-bloombergs-view
Interview with Jose Diaz-Balert and Enrique Acevedo of Univision News,https://www.presidency.ucsb.edu/documents/interview-with-jose-diaz-balert-and-enrique-acevedo-univision-news
"Interview with Zach Galifianakis on the Program ""Between Two Ferns""",https://www.presidency.ucsb.edu/documents/interview-with-zach-galifianakis-the-program-between-two-ferns
"The President's News Conference With Prime Minister Mark Rutte of the Netherlands in The Hague, Netherlands",https://www.presidency.ucsb.edu/documents/the-presidents-news-conference-with-prime-minister-mark-rutte-the-netherlands-the-hague
"The President's News Conference With President Herman Van Rompuy of the European Council and President José Manuel Durão Barroso of the European Commission in Brussels, Belgium",https://www.presidency.ucsb.edu/documents/the-presidents-news-conference-with-president-herman-van-rompuy-the-european-council-and
"Interview with Scott Pelley of CBS's ""This Morning""",https://www.presidency.ucsb.edu/documents/interview-with-scott-pelley-cbss-this-morning
"The President's News Conference With Prime Minister Matteo Renzi of Italy in Rome, Italy",https://www.presidency.ucsb.edu/documents/the-presidents-news-conference-with-prime-minister-matteo-renzi-italy-rome-italy
"Interview with Major Garrett of CBS's ""This Morning""",https://www.presidency.ucsb.edu/documents/interview-with-major-garrett-cbss-this-morning
The President's News Conference,https://www.presidency.ucsb.edu/documents/the-presidents-news-conference-1149
"The President's News Conference With Prime Minister Shinzo Abe of Japan in Tokyo, Japan",https://www.presidency.ucsb.edu/documents/the-presidents-news-conference-with-prime-minister-shinzo-abe-japan-tokyo-japan
"The President's News Conference With President Park Geun-hye of South Korea in Seoul, South Korea",https://www.presidency.ucsb.edu/documents/the-presidents-news-conference-with-president-park-geun-hye-south-korea-seoul-south-korea
"The President's News Conference With Prime Minister Najib Razak of Malaysia in Kuala Lumpur, Malaysia",https://www.presidency.ucsb.edu/documents/the-presidents-news-conference-with-prime-minister-najib-razak-malaysia-kuala-lumpur
"The President's News Conference With President Benigno S. Aquino III of the Philippines in Manila, Philippines",https://www.presidency.ucsb.edu/documents/the-presidents-news-conference-with-president-benigno-s-aquino-iii-the-philippines-manila
The President's News Conference With Chancellor Angela Merkel of Germany,https://www.presidency.ucsb.edu/documents/the-presidents-news-conference-with-chancellor-angela-merkel-germany-4
"Interview with Megan Glaros of CBS's ""This Morning""",https://www.presidency.ucsb.edu/documents/interview-with-megan-glaros-cbss-this-morning
"Interview with Al Rokker of NBC's ""Today""",https://www.presidency.ucsb.edu/documents/interview-with-al-rokker-nbcs-today
Interview with Steve Inskeep of NPR News,https://www.presidency.ucsb.edu/documents/interview-with-steve-inskeep-npr-news
"The President's News Conference With President Bronislaw Komorowski of Poland in Warsaw, Poland",https://www.presidency.ucsb.edu/documents/the-presidents-news-conference-with-president-bronislaw-komorowski-poland-warsaw-poland
"The President's News Conference With Prime Minister David Cameron of the United Kingdom in Brussels, Belgium",https://www.presidency.ucsb.edu/documents/the-presidents-news-conference-with-prime-minister-david-cameron-the-united-kingdom-1
"Interview with Jenna Bush Hager of NBC's ""Today""",https://www.presidency.ucsb.edu/documents/interview-with-jenna-bush-hager-nbcs-today
"Interview with Mika Brzezinski of MSNBC's ""Morning Joe""",https://www.presidency.ucsb.edu/documents/interview-with-mika-brzezinski-msnbcs-morning-joe
"Interview with Kate Bolduan of CNN's ""New Day""",https://www.presidency.ucsb.edu/documents/interview-with-kate-bolduan-cnns-new-day
"Interview with Norah O'Donnell of CBS ""This Morning""",https://www.presidency.ucsb.edu/documents/interview-with-norah-odonnell-cbs-this-morning
"Interview with George Stephanopoulos of ABC News ""Good Morning America""",https://www.presidency.ucsb.edu/documents/interview-with-george-stephanopoulos-abc-news-good-morning-america
"Interview with George Stephanopoulos of ABC News ""This Week""",https://www.presidency.ucsb.edu/documents/interview-with-george-stephanopoulos-abc-news-this-week-14
"Interview with Steve Liesman of CNBC's ""Fast Money""",https://www.presidency.ucsb.edu/documents/interview-with-steve-liesman-cnbcs-fast-money
The President's News Conference,https://www.presidency.ucsb.edu/documents/the-presidents-news-conference-1148
Interview with The Economist Magazine,https://www.presidency.ucsb.edu/documents/interview-with-the-economist-magazine
The President's News Conference,https://www.presidency.ucsb.edu/documents/the-presidents-news-conference-1147
"The President's News Conference With President Toomas Hendrik Ilves of Estonia in Tallinn, Estonia",https://www.presidency.ucsb.edu/documents/the-presidents-news-conference-with-president-toomas-hendrik-ilves-estonia-tallinn-estonia
"The President's News Conference in Newport, Wales",https://www.presidency.ucsb.edu/documents/the-presidents-news-conference-newport-wales
"Interview with Chuck Todd of NBC News ""Meet the Press""",https://www.presidency.ucsb.edu/documents/interview-with-chuck-todd-nbc-news-meet-the-press-5
The President's News Conference,https://www.presidency.ucsb.edu/documents/the-presidents-news-conference-1146
"Interview with Bob Schieffer of CBS News ""Face the Nation""",https://www.presidency.ucsb.edu/documents/interview-with-bob-schieffer-cbs-news-face-the-nation-11
"The President's News Conference With President Xi Jinping of China in Beijing, China",https://www.presidency.ucsb.edu/documents/the-presidents-news-conference-with-president-xi-jinping-china-beijing-china
"The President's News Conference With Member of Parliament and Leader of the National League for Democracy Party Aung San Suu Kyi of Burma in Rangoon, Burma",https://www.presidency.ucsb.edu/documents/the-presidents-news-conference-with-member-parliament-and-leader-the-national-league-for
"The President's News Conference in Brisbane, Australia",https://www.presidency.ucsb.edu/documents/the-presidents-news-conference-brisbane-australia
"Interview with George Stephanopoulos of ABC News ""This Week""",https://www.presidency.ucsb.edu/documents/interview-with-george-stephanopoulos-abc-news-this-week-13
"Interview With Jorge Ramos of Fusion and Univision News in Nashville, Tennessee",https://www.presidency.ucsb.edu/documents/interview-with-jorge-ramos-fusion-and-univision-news-nashville-tennessee
Interview with Jeff Johnson of Black Entertainment Television,https://www.presidency.ucsb.edu/documents/interview-with-jeff-johnson-black-entertainment-television
Interview with Steve Inskeep of National Public Radio,https://www.presidency.ucsb.edu/documents/interview-with-steve-inskeep-national-public-radio-1
The President's News Conference,https://www.presidency.ucsb.edu/documents/the-presidents-news-conference-1145
The President's News Conference With Prime Minister David Cameron of the United Kingdom,https://www.presidency.ucsb.edu/documents/the-presidents-news-conference-with-prime-minister-david-cameron-the-united-kingdom-0
Address Before a Joint Session of the Congress on the State of the Union,https://www.presidency.ucsb.edu/documents/address-before-joint-session-the-congress-the-state-the-union-20
Interview with Steve Grove Director of News Lab at Google,https://www.presidency.ucsb.edu/documents/interview-with-steve-grove-director-news-lab-google
The President's News Conference With Chancellor Angela Merkel of Germany,https://www.presidency.ucsb.edu/documents/the-presidents-news-conference-with-chancellor-angela-merkel-germany-3
Interview with Ben Smith of BuzzFeed,https://www.presidency.ucsb.edu/documents/interview-with-ben-smith-buzzfeed
"Interview with Kara Swisher of ""Re/code"" in Stanford, California",https://www.presidency.ucsb.edu/documents/interview-with-kara-swisher-recode-stanford-california
Interview with Robert Love of AARP at AARP Headquarters,https://www.presidency.ucsb.edu/documents/interview-with-robert-love-aarp-aarp-headquarters
Interview With Jeff Mason of Reuters,https://www.presidency.ucsb.edu/documents/interview-with-jeff-mason-reuters
Interview with Sam Stein of the Huffington Post,https://www.presidency.ucsb.edu/documents/interview-with-sam-stein-the-huffington-post
The President's News Conference With President Ashraf Ghani Ahmadzai of Afghanistan,https://www.presidency.ucsb.edu/documents/the-presidents-news-conference-with-president-ashraf-ghani-ahmadzai-afghanistan
Interview with David Simons of The Wire,https://www.presidency.ucsb.edu/documents/interview-with-david-simons-the-wire
Interview with EFE Newswire,https://www.presidency.ucsb.edu/documents/interview-with-efe-newswire
"The President's News Conference in Panama City, Panama",https://www.presidency.ucsb.edu/documents/the-presidents-news-conference-panama-city-panama
The President's News Conference With Prime Minister Matteo Renzi of Italy,https://www.presidency.ucsb.edu/documents/the-presidents-news-conference-with-prime-minister-matteo-renzi-italy-0
Interview with Gerald Seib of the Wall Street Journal,https://www.presidency.ucsb.edu/documents/interview-with-gerald-seib-the-wall-street-journal
The President's News Conference With Prime Minister Shinzo Abe of Japan,https://www.presidency.ucsb.edu/documents/the-presidents-news-conference-with-prime-minister-shinzo-abe-japan-0
"The President's News Conference at Camp David, Maryland",https://www.presidency.ucsb.edu/documents/the-presidents-news-conference-camp-david-maryland
Interview with Nadia Bilbassy-Charters of Al Arabiya News Channel,https://www.presidency.ucsb.edu/documents/interview-with-nadia-bilbassy-charters-al-arabiya-news-channel
