Title,Link
Keynote Address at the 2004 Democratic National Convention,https://www.presidency.ucsb.edu/documents/keynote-address-the-2004-democratic-national-convention
"Address Accepting the Presidential Nomination at the Democratic National Convention in Denver: ""The American Promise""",https://www.presidency.ucsb.edu/documents/address-accepting-the-presidential-nomination-the-democratic-national-convention-denver
Inaugural Address,https://www.presidency.ucsb.edu/documents/inaugural-address-5
Interview with Hisham Melhem of Al Arabiya,https://www.presidency.ucsb.edu/documents/interview-with-hisham-melhem-al-arabiya
"Interview With Matt Lauer of NBC's ""Today""",https://www.presidency.ucsb.edu/documents/interview-with-matt-lauer-nbcs-today-1
Interview with Katie Couric of CBS News,https://www.presidency.ucsb.edu/documents/interview-with-katie-couric-cbs-news-0
Interview with Brian Williams of NBC News,https://www.presidency.ucsb.edu/documents/interview-with-brian-williams-nbc-news
Interview with Charles Gibson of ABC News,https://www.presidency.ucsb.edu/documents/interview-with-charles-gibson-abc-news
Interview with Chris Wallace on Fox News,https://www.presidency.ucsb.edu/documents/interview-with-chris-wallace-fox-news
The President's News Conference,https://www.presidency.ucsb.edu/documents/the-presidents-news-conference-1125
Interview with Columnists of the Washington Post,https://www.presidency.ucsb.edu/documents/interview-with-columnists-the-washington-post
Interview With Peter Mansbridge of Canadian Broadcasting Corporation,https://www.presidency.ucsb.edu/documents/interview-with-peter-mansbridge-canadian-broadcasting-corporation
"Radio Interview via Telephone with Eddie ""Piolín"" Sotelo",https://www.presidency.ucsb.edu/documents/radio-interview-via-telephone-with-eddie-piolin-sotelo
"The President's News Conference With Prime Minister Stephen Harper of Canada in Ottawa, Canada",https://www.presidency.ucsb.edu/documents/the-presidents-news-conference-with-prime-minister-stephen-harper-canada-ottawa-canada
"Interview with Jim Lehrer on PBS' the ""News Hour""",https://www.presidency.ucsb.edu/documents/interview-with-jim-lehrer-pbs-the-news-hour-0
Interview With Hisham Melhem of Al-Arabiya Arab TV Network,https://www.presidency.ucsb.edu/documents/interview-with-hisham-melhem-al-arabiya-arab-tv-network
Interview With Master Sergeant Rusty Barfield of the Pentagon Channel,https://www.presidency.ucsb.edu/documents/interview-with-master-sergeant-rusty-barfield-the-pentagon-channel
Interview With Regional Reporters,https://www.presidency.ucsb.edu/documents/interview-with-regional-reporters
"Interview With Jay Leno of ""The Tonight Show"" in Burbank, California",https://www.presidency.ucsb.edu/documents/interview-with-jay-leno-the-tonight-show-burbank-california
"Interview with Steve Kroft on CBS News' ""60 Minutes""",https://www.presidency.ucsb.edu/documents/interview-with-steve-kroft-cbs-news-60-minutes
The President's News Conference,https://www.presidency.ucsb.edu/documents/the-presidents-news-conference-1123
"Interview with Lionel Barber, Chrystia Freeland, and Edward Luce of the ""Financial Times""",https://www.presidency.ucsb.edu/documents/interview-with-lionel-barber-chrystia-freeland-and-edward-luce-the-financial-times
"Interview with Bob Schieffer on CBS News' ""Face the Nation""",https://www.presidency.ucsb.edu/documents/interview-with-bob-schieffer-cbs-news-face-the-nation-0
"The President's News Conference With Prime Minister Gordon Brown of the Untied Kingdom in London, England",https://www.presidency.ucsb.edu/documents/the-presidents-news-conference-with-prime-minister-gordon-brown-the-untied-kingdom-london
The President's News Conference in London,https://www.presidency.ucsb.edu/documents/the-presidents-news-conference-london
"The President's News Conference With President Nicolas Sarkozy of France in Strasbourg, France",https://www.presidency.ucsb.edu/documents/the-presidents-news-conference-with-president-nicolas-sarkozy-france-strasbourg-france
"The President's News Conference With Chancellor Angela Merkel of Germany in Baden-Baden, Germany",https://www.presidency.ucsb.edu/documents/the-presidents-news-conference-with-chancellor-angela-merkel-germany-baden-baden-germany
The President's News Conference in Strasbourg,https://www.presidency.ucsb.edu/documents/the-presidents-news-conference-strasbourg
"The President's News Conference With President Abdullah Gul of Turkey in Ankara, Turkey",https://www.presidency.ucsb.edu/documents/the-presidents-news-conference-with-president-abdullah-gul-turkey-ankara-turkey
Interview With Juan Carlos Lopez of CNN En Espanol,https://www.presidency.ucsb.edu/documents/interview-with-juan-carlos-lopez-cnn-en-espanol-0
The President's News Conference With President Felipe de Jesus Calderon Hinojosa of Mexico in Mexico City,https://www.presidency.ucsb.edu/documents/the-presidents-news-conference-with-president-felipe-de-jesus-calderon-hinojosa-mexico-1
The President's News Conference in Port of Spain,https://www.presidency.ucsb.edu/documents/the-presidents-news-conference-port-spain
The President's News Conference,https://www.presidency.ucsb.edu/documents/the-presidents-news-conference-1124
Interview With Laurence Haim of Canal Plus Television,https://www.presidency.ucsb.edu/documents/interview-with-laurence-haim-canal-plus-television
Interview With Justin Webb of BBC World News,https://www.presidency.ucsb.edu/documents/interview-with-justin-webb-bbc-world-news
Interview With Michele Norris and Steve Inskeep of National Public Radio,https://www.presidency.ucsb.edu/documents/interview-with-michele-norris-and-steve-inskeep-national-public-radio
Interview With Foreign Journalists in Cairo,https://www.presidency.ucsb.edu/documents/interview-with-foreign-journalists-cairo
"The President's News Conference With Chancellor Angela Merkel of Germany in Dresden, Germany",https://www.presidency.ucsb.edu/documents/the-presidents-news-conference-with-chancellor-angela-merkel-germany-dresden-germany
"The President's News Conference With President Nicolas Sarkozy of France in Caen, France",https://www.presidency.ucsb.edu/documents/the-presidents-news-conference-with-president-nicolas-sarkozy-france-caen-france
Interview with John Harwood of CNBC,https://www.presidency.ucsb.edu/documents/interview-with-john-harwood-cnbc-2
The President's News Conference With President Lee Myung-bak of South Korea,https://www.presidency.ucsb.edu/documents/the-presidents-news-conference-with-president-lee-myung-bak-south-korea-0
Transcript of the President's Answer to Harry Smith's Question on Iran,https://www.presidency.ucsb.edu/documents/transcript-the-presidents-answer-harry-smiths-question-iran
The President's News Conference,https://www.presidency.ucsb.edu/documents/the-presidents-news-conference-1122
The President's News Conference With Chancellor Angela Merkel of Germany,https://www.presidency.ucsb.edu/documents/the-presidents-news-conference-with-chancellor-angela-merkel-germany-2
Interview With ITAR-TASS/Rossiya TV,https://www.presidency.ucsb.edu/documents/interview-with-itar-tassrossiya-tv
Interview With AllAfrica.com,https://www.presidency.ucsb.edu/documents/interview-with-allafricacom
Interview with Novaya Gazeta,https://www.presidency.ucsb.edu/documents/interview-with-novaya-gazeta
The President's News Conference With President Dmitry A. Medvedev of Russia in Moscow,https://www.presidency.ucsb.edu/documents/the-presidents-news-conference-with-president-dmitry-medvedev-russia-moscow
"The President's News Conference in L'Aquila, Italy",https://www.presidency.ucsb.edu/documents/the-presidents-news-conference-laquila-italy
The President's News Conference With Prime Minister Nuri al-Maliki of Iraq,https://www.presidency.ucsb.edu/documents/the-presidents-news-conference-with-prime-minister-nuri-al-maliki-iraq-1
The President's News Conference,https://www.presidency.ucsb.edu/documents/the-presidents-news-conference-1121
"The President's News Conference With President Felipe de Jesus Calderon Hinojosa of Mexico and Prime Minister Stephen Harper of Canada in Guadalajara, Mexico",https://www.presidency.ucsb.edu/documents/the-presidents-news-conference-with-president-felipe-de-jesus-calderon-hinojosa-mexico-and
"Interview With Michael A. Smerconish of the ""Michael Smerconish Morning Show""",https://www.presidency.ucsb.edu/documents/interview-with-michael-smerconish-the-michael-smerconish-morning-show
"Interview with George Stephanopoulos on ABC News' ""This Week""",https://www.presidency.ucsb.edu/documents/interview-with-george-stephanopoulos-abc-news-this-week
"Interview with David Gregory on NBC News' ""Meet the Press""",https://www.presidency.ucsb.edu/documents/interview-with-david-gregory-nbc-news-meet-the-press
"Interview with John King on CNN's ""State of the Union""",https://www.presidency.ucsb.edu/documents/interview-with-john-king-cnns-state-the-union
"Interview with Bob Schieffer on CBS News' ""Face the Nation""",https://www.presidency.ucsb.edu/documents/interview-with-bob-schieffer-cbs-news-face-the-nation
"Interview with Jorge Ramos on the Univision Network Program ""Al Punto"" (translated to Spanish)",https://www.presidency.ucsb.edu/documents/interview-with-jorge-ramos-the-univision-network-program-al-punto-translated-spanish
The President's News Conference in Pittsburgh,https://www.presidency.ucsb.edu/documents/the-presidents-news-conference-pittsburgh
"Interview with Savannah Guthrie on NBC's ""Today""",https://www.presidency.ucsb.edu/documents/interview-with-savannah-guthrie-nbcs-today
"Interview with Jake Tapper on ABC's ""Good Morning America""",https://www.presidency.ucsb.edu/documents/interview-with-jake-tapper-abcs-good-morning-america-0
"The President's News Conference With Prime Minister Yukio Hatoyama of Japan in Tokyo, Japan",https://www.presidency.ucsb.edu/documents/the-presidents-news-conference-with-prime-minister-yukio-hatoyama-japan-tokyo-japan
"Interview With Ed Henry on CNN's ""The Situation Room""",https://www.presidency.ucsb.edu/documents/interview-with-ed-henry-cnns-the-situation-room
"Interview with Chip Reid on CBS' ""Early Show""",https://www.presidency.ucsb.edu/documents/interview-with-chip-reid-cbs-early-show
"Interview with Chuck Todd on NBC's ""Today""",https://www.presidency.ucsb.edu/documents/interview-with-chuck-todd-nbcs-today-0
Interview With Xiang Xi of the Southern Weekly in Beijing,https://www.presidency.ucsb.edu/documents/interview-with-xiang-xi-the-southern-weekly-beijing
The President's News Conference With President Lee Myung-bak of South Korea in South Korea,https://www.presidency.ucsb.edu/documents/the-presidents-news-conference-with-president-lee-myung-bak-south-korea-south-korea
The President's News Conference With Prime Minister Manmohan Singh of India,https://www.presidency.ucsb.edu/documents/the-presidents-news-conference-with-prime-minister-manmohan-singh-india
"Interview With Steve Kroft on CBS' ""60 Minutes""",https://www.presidency.ucsb.edu/documents/interview-with-steve-kroft-cbs-60-minutes-1
The President's News Conference in Copenhagen,https://www.presidency.ucsb.edu/documents/the-presidents-news-conference-copenhagen
Interview With April Ryan of American Urban Radio Networks,https://www.presidency.ucsb.edu/documents/interview-with-april-ryan-american-urban-radio-networks
"Interview With Robert Siegel and Julie Rovner on NPR's ""All Things Considered""",https://www.presidency.ucsb.edu/documents/interview-with-robert-siegel-and-julie-rovner-nprs-all-things-considered
"Interview With Jim Lehrer on PBS' ""The News Hour""",https://www.presidency.ucsb.edu/documents/interview-with-jim-lehrer-pbs-the-news-hour
"Interview with George Stephanopoulos of ABC's ""Good Morning America""",https://www.presidency.ucsb.edu/documents/interview-with-george-stephanopoulos-abcs-good-morning-america
"Interview With Diane Sawyer on ABC's ""Good Morning America""",https://www.presidency.ucsb.edu/documents/interview-with-diane-sawyer-abcs-good-morning-america
Address Before a Joint Session of the Congress on the State of the Union,https://www.presidency.ucsb.edu/documents/address-before-joint-session-the-congress-the-state-the-union-17
"Interview With Steve Grove on ""YouTube""",https://www.presidency.ucsb.edu/documents/interview-with-steve-grove-youtube-0
Interview With Katie Couric of CBS News,https://www.presidency.ucsb.edu/documents/interview-with-katie-couric-cbs-news
The President's News Conference,https://www.presidency.ucsb.edu/documents/the-presidents-news-conference-1120
"Interview With Jake Tapper on ABC's ""Good Morning America""",https://www.presidency.ucsb.edu/documents/interview-with-jake-tapper-abcs-good-morning-america
"Interview With Bret Baier on Fox News Channel's ""Special Report""",https://www.presidency.ucsb.edu/documents/interview-with-bret-baier-fox-news-channels-special-report
"Interview With Matt Lauer on NBC's ""Today""",https://www.presidency.ucsb.edu/documents/interview-with-matt-lauer-nbcs-today-0
The President's News Conference With President Nicolas Sarkozy of France,https://www.presidency.ucsb.edu/documents/the-presidents-news-conference-with-president-nicolas-sarkozy-france
"Interview With Harry Smith on CBS's ""Early Show""",https://www.presidency.ucsb.edu/documents/interview-with-harry-smith-cbss-early-show
"Remarks on Signing the Strategic Arms Reduction Treaty With President Dmitry A. Medvedev of Russia and an Exchange With Reporters in Prague, Czech Republic",https://www.presidency.ucsb.edu/documents/remarks-signing-the-strategic-arms-reduction-treaty-with-president-dmitry-medvedev-russia
"Interview With George Stephanopoulos on ABC's ""Good Morning America""",https://www.presidency.ucsb.edu/documents/interview-with-george-stephanopoulos-abcs-good-morning-america-0
The President's News Conference,https://www.presidency.ucsb.edu/documents/the-presidents-news-conference-1119
Interview With John Harwood of CNBC,https://www.presidency.ucsb.edu/documents/interview-with-john-harwood-cnbc
Interview With Sergey Brilev of Rossiya TV,https://www.presidency.ucsb.edu/documents/interview-with-sergey-brilev-rossiya-tv
The President's News Conference With President Hamid Karzai of Afghanistan,https://www.presidency.ucsb.edu/documents/the-presidents-news-conference-with-president-hamid-karzai-afghanistan-2
The President's News Conference With President Felipe de Jesus Calderon Hinojosa of Mexico,https://www.presidency.ucsb.edu/documents/the-presidents-news-conference-with-president-felipe-de-jesus-calderon-hinojosa-mexico-0
Interview With Marv Albert of Turner Network Television (TNT),https://www.presidency.ucsb.edu/documents/interview-with-marv-albert-turner-network-television-tnt
The President's News Conference,https://www.presidency.ucsb.edu/documents/the-presidents-news-conference-1118
"Interview With Larry King on CNN's ""Larry King Live""",https://www.presidency.ucsb.edu/documents/interview-with-larry-king-cnns-larry-king-live-0
"Interview With Matt Lauer on NBC's ""Today""",https://www.presidency.ucsb.edu/documents/interview-with-matt-lauer-nbcs-today
The President's News Conference With President Dmitry A. Medvedev of Russia,https://www.presidency.ucsb.edu/documents/the-presidents-news-conference-with-president-dmitry-medvedev-russia
The President's News Conference in Toronto,https://www.presidency.ucsb.edu/documents/the-presidents-news-conference-toronto
Interview With Yonit Levi of Israel's Channel 2 News,https://www.presidency.ucsb.edu/documents/interview-with-yonit-levi-israels-channel-2-news
Interview With the South African Broadcasting Corporation,https://www.presidency.ucsb.edu/documents/interview-with-the-south-african-broadcasting-corporation-0
"Interview With Chuck Todd on MSNBC's ""The Daily Rundown""",https://www.presidency.ucsb.edu/documents/interview-with-chuck-todd-msnbcs-the-daily-rundown
"Interview With Chuck Todd on NBC's ""Today""",https://www.presidency.ucsb.edu/documents/interview-with-chuck-todd-nbcs-today
The President's News Conference With Prime Minister David Cameron of the United Kingdom,https://www.presidency.ucsb.edu/documents/the-presidents-news-conference-with-prime-minister-david-cameron-the-united-kingdom
"Interview on ABC's ""Good Morning America""",https://www.presidency.ucsb.edu/documents/interview-abcs-good-morning-america
"Interview on ABC's ""The View""",https://www.presidency.ucsb.edu/documents/interview-abcs-the-view
"Interview With Harry Smith on CBS' ""Early Show""",https://www.presidency.ucsb.edu/documents/interview-with-harry-smith-cbs-early-show
Interview With Andrea Mitchell of MSNBC,https://www.presidency.ucsb.edu/documents/interview-with-andrea-mitchell-msnbc
"Interview With Brian Williams on ""NBC Nightly News""",https://www.presidency.ucsb.edu/documents/interview-with-brian-williams-nbc-nightly-news
The President's News Conference,https://www.presidency.ucsb.edu/documents/the-presidents-news-conference-1117
Interview With Bahman Kalbasi of BBC Persian in New York City,https://www.presidency.ucsb.edu/documents/interview-with-bahman-kalbasi-bbc-persian-new-york-city
Excerpts of Interview with Peter Baker of the New York Times,https://www.presidency.ucsb.edu/documents/excerpts-interview-with-peter-baker-the-new-york-times
"Interview With Ron Fournier and Ronald Brownstein of ""National Journal""",https://www.presidency.ucsb.edu/documents/interview-with-ron-fournier-and-ronald-brownstein-national-journal
"Interview With Eddie ""Piolin"" Sotelo on Univision Radio Network's ""Piolin pr la Manana""",https://www.presidency.ucsb.edu/documents/interview-with-eddie-piolin-sotelo-univision-radio-networks-piolin-pr-la-manana
"Interview with Jon Stewart on Comedy Central's ""The Daily Show""",https://www.presidency.ucsb.edu/documents/interview-with-jon-stewart-comedy-centrals-the-daily-show
Interview with Progressive Bloggers,https://www.presidency.ucsb.edu/documents/interview-with-progressive-bloggers
Interview With Michael Smerconish on MSNBC,https://www.presidency.ucsb.edu/documents/interview-with-michael-smerconish-msnbc
The President's News Conference,https://www.presidency.ucsb.edu/documents/the-presidents-news-conference-1115
"Interview With Steve Kroft on CBS' ""Early Show""",https://www.presidency.ucsb.edu/documents/interview-with-steve-kroft-cbs-early-show
"Interview With Steve Kroft on CBS ""60 Minutes""",https://www.presidency.ucsb.edu/documents/interview-with-steve-kroft-cbs-60-minutes-0
The President's News Conference With Prime Minister Manmohan Singh of India in New Delhi,https://www.presidency.ucsb.edu/documents/the-presidents-news-conference-with-prime-minister-manmohan-singh-india-new-delhi
The President's News Conference With President Susilo Bambang Yudhoyono of Indonesia in Jakarta,https://www.presidency.ucsb.edu/documents/the-presidents-news-conference-with-president-susilo-bambang-yudhoyono-indonesia-jakarta
The President's News Conference With President Lee Myung-bak of South Korea in Seoul,https://www.presidency.ucsb.edu/documents/the-presidents-news-conference-with-president-lee-myung-bak-south-korea-seoul
The President's News Conference in Seoul,https://www.presidency.ucsb.edu/documents/the-presidents-news-conference-seoul
"The President's News Conference in Lisbon, Portugal",https://www.presidency.ucsb.edu/documents/the-presidents-news-conference-lisbon-portugal
"Interview With The First Lady and Barbara Walters on ABC's ""A Barbara Walters Special: A Thanksgiving Visit with President and Mrs. Obama""",https://www.presidency.ucsb.edu/documents/interview-with-the-first-lady-and-barbara-walters-abcs-barbara-walters-special
The President's News Conference,https://www.presidency.ucsb.edu/documents/the-presidents-news-conference-1116
"Interview With Steve Inskeep on National Public Radio's ""Morning Edition""",https://www.presidency.ucsb.edu/documents/interview-with-steve-inskeep-national-public-radios-morning-edition
The President's News Conference,https://www.presidency.ucsb.edu/documents/the-presidents-news-conference-1114
The President's News Conference With President Hu Jintao of China,https://www.presidency.ucsb.edu/documents/the-presidents-news-conference-with-president-hu-jintao-china
Address Before a Joint Session of the Congress on the State of the Union,https://www.presidency.ucsb.edu/documents/address-before-joint-session-the-congress-the-state-the-union-16
Interview With Steve Grove of YouTube,https://www.presidency.ucsb.edu/documents/interview-with-steve-grove-youtube
The President's News Conference With Prime Minister Stephen J. Harper of Canada,https://www.presidency.ucsb.edu/documents/the-presidents-news-conference-with-prime-minister-stephen-j-harper-canada-0
Interview With Bill O'Reilly of Fox News,https://www.presidency.ucsb.edu/documents/interview-with-bill-oreilly-fox-news
The President's News Conference,https://www.presidency.ucsb.edu/documents/the-presidents-news-conference-1113
The President's News Conference With President Felipe de Jesus Calderon Hinojosa of Mexico,https://www.presidency.ucsb.edu/documents/the-presidents-news-conference-with-president-felipe-de-jesus-calderon-hinojosa-mexico
The President's News Conference,https://www.presidency.ucsb.edu/documents/the-presidents-news-conference-1112
"The President's News Conference With President Sebastian Pinera Echenique of Chile in Santiago, Chile",https://www.presidency.ucsb.edu/documents/the-presidents-news-conference-with-president-sebastian-pinera-echenique-chile-santiago
"The President's News Conference With President Carlos Mauricio Funes Cartagena of El Salvador in San Salvador, El Salvador",https://www.presidency.ucsb.edu/documents/the-presidents-news-conference-with-president-carlos-mauricio-funes-cartagena-el-salvador
Interview With Juan Carlos Lopez of Corriente Latina,https://www.presidency.ucsb.edu/documents/interview-with-juan-carlos-lopez-corriente-latina
"Interview With Diane Sawyer on ABC ""World News Tonight""",https://www.presidency.ucsb.edu/documents/interview-with-diane-sawyer-abc-world-news-tonight
Interview With David Crabtree of WRAL,https://www.presidency.ucsb.edu/documents/interview-with-david-crabtree-wral
"Interview With Steve Kroft on CBS ""60 Minutes""",https://www.presidency.ucsb.edu/documents/interview-with-steve-kroft-cbs-60-minutes
Interview With Andrew Marr of the BBC,https://www.presidency.ucsb.edu/documents/interview-with-andrew-marr-the-bbc
The President's News Conference With Prime Minister David Cameron of the United Kingdom in London,https://www.presidency.ucsb.edu/documents/the-presidents-news-conference-with-prime-minister-david-cameron-the-united-kingdom-london
The President's News Conference With Prime Minister Donald Tusk of Poland in Warsaw,https://www.presidency.ucsb.edu/documents/the-presidents-news-conference-with-prime-minister-donald-tusk-poland-warsaw
The President's News Conference With Chancellor Angela Merkel of Germany,https://www.presidency.ucsb.edu/documents/the-presidents-news-conference-with-chancellor-angela-merkel-germany-1
The President's News Conference,https://www.presidency.ucsb.edu/documents/the-presidents-news-conference-1111
The President's News Conference,https://www.presidency.ucsb.edu/documents/the-presidents-news-conference-1109
The President's News Conference,https://www.presidency.ucsb.edu/documents/the-presidents-news-conference-1110
"Interview With Jerry Revish of WBNS 10TV News in Columbus, Ohio",https://www.presidency.ucsb.edu/documents/interview-with-jerry-revish-wbns-10tv-news-columbus-ohio
Interview With Michel Martin of National Public Radio,https://www.presidency.ucsb.edu/documents/interview-with-michel-martin-national-public-radio
Interview With Wolf Blitzer of CNN,https://www.presidency.ucsb.edu/documents/interview-with-wolf-blitzer-cnn-0
Interview With Anthony Mason of CBS News,https://www.presidency.ucsb.edu/documents/interview-with-anthony-mason-cbs-news-0
Interview With Anthony Mason of CBS News,https://www.presidency.ucsb.edu/documents/interview-with-anthony-mason-cbs-news
Interview on The Tom Joyner Morning Show With Tom Joyner and Sybil Wilkes,https://www.presidency.ucsb.edu/documents/interview-the-tom-joyner-morning-show-with-tom-joyner-and-sybil-wilkes
Interview with Emmett Miller of Black Entertainment Television,https://www.presidency.ucsb.edu/documents/interview-with-emmett-miller-black-entertainment-television
Interview With George Stephanopoulos of ABC News,https://www.presidency.ucsb.edu/documents/interview-with-george-stephanopoulos-abc-news
The President's News Conference,https://www.presidency.ucsb.edu/documents/the-presidents-news-conference-1108
The President's News Conference With President Lee Myung-bak of South Korea,https://www.presidency.ucsb.edu/documents/the-presidents-news-conference-with-president-lee-myung-bak-south-korea
"Interview With Jake Tapper on ABC News ""Nightline""",https://www.presidency.ucsb.edu/documents/interview-with-jake-tapper-abc-news-nightline
"Interview With Jay Leno on NBC's ""The Tonight Show""",https://www.presidency.ucsb.edu/documents/interview-with-jay-leno-nbcs-the-tonight-show
Interview with Mark Wilson of FOX 13 - Tampa Bay,https://www.presidency.ucsb.edu/documents/interview-with-mark-wilson-fox-13-tampa-bay
The President's News Conference in Cannes,https://www.presidency.ucsb.edu/documents/the-presidents-news-conference-cannes
Interview with Andy Katz of ESPN,https://www.presidency.ucsb.edu/documents/interview-with-andy-katz-espn
The President's News Conference in Kapolei,https://www.presidency.ucsb.edu/documents/the-presidents-news-conference-kapolei
